$ bash -c lspci -vvv 2>&1 | head -400
---
00:00.0 Host bridge: Intel Corporation Comet Lake-U v1 4c Host Bridge/DRAM Controller (rev 0c)
	Subsystem: Hewlett-Packard Company Device 8723
	Control: I/O- Mem+ BusMaster+ SpecCycle- MemWINV- VGASnoop- ParErr- Stepping- SERR- FastB2B- DisINTx-
	Status: Cap+ 66MHz- UDF- FastB2B+ ParErr- DEVSEL=fast >TAbort- <TAbort- <MAbort- >SERR- <PERR- INTx-
	Latency: 0
	IOMMU group: 1
	Capabilities: <access denied>
	Kernel driver in use: skl_uncore

00:02.0 VGA compatible controller: Intel Corporation CometLake-U GT2 [UHD Graphics] (rev 02) (prog-if 00 [VGA controller])
	DeviceName: Onboard IGD
	Subsystem: Hewlett-Packard Company Device 8723
	Control: I/O+ Mem+ BusMaster+ SpecCycle- MemWINV- VGASnoop- ParErr- Stepping- SERR- FastB2B- DisINTx+
	Status: Cap+ 66MHz- UDF- FastB2B- ParErr- DEVSEL=fast >TAbort- <TAbort- <MAbort- >SERR- <PERR- INTx-
	Latency: 0
	Interrupts: pin B disabled, MSI(X) routed to IRQ 152
	IOMMU group: 0
	Region 0: Memory at df000000 (64-bit, non-prefetchable) [size=16M]
	Region 2: Memory at a0000000 (64-bit, prefetchable) [size=256M]
	Region 4: I/O ports at 3000 [size=64]
	Expansion ROM at 000c0000 [virtual] [disabled] [size=128K]
	Capabilities: <access denied>
	Kernel driver in use: i915
	Kernel modules: i915

00:04.0 Signal processing controller: Intel Corporation Xeon E3-1200 v5/E3-1500 v5/6th Gen Core Processor Thermal Subsystem (rev 0c)
	Subsystem: Hewlett-Packard Company Device 8723
	Control: I/O- Mem+ BusMaster- SpecCycle- MemWINV- VGASnoop- ParErr- Stepping- SERR- FastB2B- DisINTx-
	Status: Cap+ 66MHz- UDF- FastB2B+ ParErr- DEVSEL=fast >TAbort- <TAbort- <MAbort- >SERR- <PERR- INTx-
	Interrupts: pin B routed to IRQ 16
	IOMMU group: 2
	Region 0: Memory at 404a100000 (64-bit, non-prefetchable) [size=32K]
	Capabilities: <access denied>
	Kernel driver in use: proc_thermal
	Kernel modules: processor_thermal_device_pci_legacy

00:12.0 Signal processing controller: Intel Corporation 400 Series Chipset Family On-Package Thermal Subsystem
	Subsystem: Hewlett-Packard Company Device 8723
	Control: I/O- Mem+ BusMaster- SpecCycle- MemWINV- VGASnoop- ParErr- Stepping- SERR- FastB2B- DisINTx-
	Status: Cap+ 66MHz- UDF- FastB2B- ParErr- DEVSEL=fast >TAbort- <TAbort- <MAbort- >SERR- <PERR- INTx-
	Interrupts: pin B routed to IRQ 16
	IOMMU group: 3
	Region 0: Memory at 404a111000 (64-bit, non-prefetchable) [size=4K]
	Capabilities: <access denied>
	Kernel driver in use: intel_pch_thermal
	Kernel modules: intel_pch_thermal

00:14.0 USB controller: Intel Corporation 400 Series Chipset Family On-Package USB 3.2 Gen 2x1 (10 Gbs) xHCI Host Controller (prog-if 30 [XHCI])
	Subsystem: Hewlett-Packard Company Device 8723
	Control: I/O- Mem+ BusMaster+ SpecCycle- MemWINV- VGASnoop- ParErr- Stepping- SERR- FastB2B- DisINTx+
	Status: Cap+ 66MHz- UDF- FastB2B+ ParErr- DEVSEL=medium >TAbort- <TAbort- <MAbort- >SERR- <PERR- INTx-
	Latency: 0
	Interrupts: pin B disabled, MSI(X) routed to IRQ 127-134
	IOMMU group: 4
	Region 0: Memory at e0100000 (64-bit, non-prefetchable) [size=64K]
	Capabilities: <access denied>
	Kernel driver in use: xhci_hcd
	Kernel modules: xhci_pci

00:14.2 RAM memory: Intel Corporation 400 Series Chipset Family On-Package Shared SRAM
	Subsystem: Hewlett-Packard Company Device 8723
	Control: I/O- Mem- BusMaster- SpecCycle- MemWINV- VGASnoop- ParErr- Stepping- SERR- FastB2B- DisINTx-
	Status: Cap+ 66MHz- UDF- FastB2B- ParErr- DEVSEL=fast >TAbort- <TAbort- <MAbort- >SERR- <PERR- INTx-
	IOMMU group: 4
	Region 0: Memory at e0114000 (64-bit, non-prefetchable) [disabled] [size=8K]
	Region 2: Memory at 404a110000 (64-bit, non-prefetchable) [disabled] [size=4K]
	Capabilities: <access denied>

00:14.3 Network controller: Intel Corporation 400 Series Chipset Family On-Package CNVi WiFi
	Subsystem: Intel Corporation Dual Band Wi-Fi 6(802.11ax) AX201 160MHz 2x2 [Harrison Peak]
	Control: I/O- Mem+ BusMaster+ SpecCycle- MemWINV- VGASnoop- ParErr- Stepping- SERR- FastB2B- DisINTx+
	Status: Cap+ 66MHz- UDF- FastB2B- ParErr- DEVSEL=fast >TAbort- <TAbort- <MAbort- >SERR- <PERR- INTx-
	Latency: 0
	Interrupts: pin B disabled, MSI(X) routed to IRQ 172-181
	IOMMU group: 5
	Region 0: Memory at e0110000 (64-bit, non-prefetchable) [size=16K]
	Capabilities: <access denied>
	Kernel driver in use: iwlwifi
	Kernel modules: iwlwifi

00:15.0 Serial bus controller: Intel Corporation 400 Series Chipset Family On-Package (details in full lspci)
	Subsystem: Hewlett-Packard Company Device 8723
	Control: I/O- Mem+ BusMaster+ SpecCycle- MemWINV- VGASnoop- ParErr- Stepping- SERR- FastB2B- DisINTx-
	Status: Cap+ 66MHz- UDF- FastB2B- ParErr- DEVSEL=fast >TAbort- <TAbort- <MAbort- >SERR- <PERR- INTx-
	Latency: 0, Cache Line Size: 64 bytes
	Interrupts: pin B routed to IRQ 16
	IOMMU group: 6
	Region 0: Memory at 404a10e000 (64-bit, non-prefetchable) [size=4K]
	Capabilities: <access denied>
	Kernel driver in use: intel-lpss
	Kernel modules: intel_lpss_pci

00:15.1 Serial bus controller: Intel Corporation 400 Series Chipset Family On-Package (details in full lspci)
	Subsystem: Hewlett-Packard Company Device 8723
	Control: I/O- Mem+ BusMaster+ SpecCycle- MemWINV- VGASnoop- ParErr- Stepping- SERR- FastB2B- DisINTx-
	Status: Cap+ 66MHz- UDF- FastB2B- ParErr- DEVSEL=fast >TAbort- <TAbort- <MAbort- >SERR- <PERR- INTx-
	Latency: 0, Cache Line Size: 64 bytes
	Interrupts: pin C routed to IRQ 17
	IOMMU group: 6
	Region 0: Memory at 404a10f000 (64-bit, non-prefetchable) [size=4K]
	Capabilities: <access denied>
	Kernel driver in use: intel-lpss
	Kernel modules: intel_lpss_pci

00:16.0 Communication controller: Intel Corporation 400 Series Chipset Family On-Package MEI #1
	Subsystem: Hewlett-Packard Company Device 8723
	Control: I/O- Mem+ BusMaster+ SpecCycle- MemWINV- VGASnoop- ParErr- Stepping- SERR- FastB2B- DisINTx+
	Status: Cap+ 66MHz- UDF- FastB2B- ParErr- DEVSEL=fast >TAbort- <TAbort- <MAbort- >SERR- <PERR- INTx-
	Latency: 0
	Interrupts: pin B disabled, MSI(X) routed to IRQ 153
	IOMMU group: 7
	Region 0: Memory at 404a10d000 (64-bit, non-prefetchable) [size=4K]
	Capabilities: <access denied>
	Kernel driver in use: mei_me
	Kernel modules: mei_me

00:16.3 Serial bus controller: Intel Corporation 400 Series Chipset Family On-Package (details in full lspci)
	Subsystem: Hewlett-Packard Company Device 8723
	Control: I/O+ Mem+ BusMaster- SpecCycle- MemWINV- VGASnoop- ParErr- Stepping- SERR- FastB2B- DisINTx-
	Status: Cap+ 66MHz+ UDF- FastB2B+ ParErr- DEVSEL=fast >TAbort- <TAbort- <MAbort- >SERR- <PERR- INTx-
	Interrupts: pin E routed to IRQ 19
	IOMMU group: 7
	Region 0: I/O ports at 3060 [size=8]
	Region 1: Memory at e0117000 (32-bit, non-prefetchable) [size=4K]
	Capabilities: <access denied>
	Kernel driver in use: serial
	<REDACTED_SERIAL>

00:1c.0 PCI bridge: Intel Corporation 400 Series Chipset Family On-Package PCIe Root Port #5 (rev f0) (prog-if 00 [Normal decode])
	Subsystem: Hewlett-Packard Company Device 8723
	Control: I/O+ Mem+ BusMaster+ SpecCycle- MemWINV- VGASnoop- ParErr- Stepping- SERR- FastB2B- DisINTx+
	Status: Cap+ 66MHz- UDF- FastB2B- ParErr- DEVSEL=fast >TAbort- <TAbort- <MAbort- >SERR- <PERR- INTx-
	Latency: 0
	Interrupts: pin B disabled, MSI(X) routed to IRQ 123
	IOMMU group: 8
	Bus: primary=00, secondary=01, subordinate=6a, sec-latency=0
	I/O behind bridge: 4000-6fff [size=12K] [16-bit]
	Memory behind bridge: b0000000-de0fffff [size=737M] [32-bit]
	Prefetchable memory behind bridge: 4000000000-4049ffffff [size=1184M] [32-bit]
	Secondary status: 66MHz- FastB2B- ParErr- DEVSEL=fast >TAbort- <TAbort- <MAbort+ <SERR- <PERR-
	BridgeCtl: Parity- SERR+ NoISA- VGA- VGA16- MAbort- >Reset- FastB2B-
		PriDiscTmr- SecDiscTmr- DiscTmrStat- DiscTmrSERREn-
	Capabilities: <access denied>
	Kernel driver in use: pcieport
	Kernel modules: shpchp

00:1d.0 PCI bridge: Intel Corporation 400 Series Chipset Family On-Package PCIe Root Port #9 (rev f0) (prog-if 00 [Normal decode])
	Subsystem: Hewlett-Packard Company Device 8723
	Control: I/O+ Mem+ BusMaster+ SpecCycle- MemWINV- VGASnoop- ParErr- Stepping- SERR- FastB2B- DisINTx+
	Status: Cap+ 66MHz- UDF- FastB2B- ParErr- DEVSEL=fast >TAbort- <TAbort- <MAbort- >SERR- <PERR- INTx-
	Latency: 0
	Interrupts: pin B disabled, MSI(X) routed to IRQ 124
	IOMMU group: 9
	Bus: primary=00, secondary=6b, subordinate=6b, sec-latency=0
	I/O behind bridge: f000-0fff [disabled] [16-bit]
	Memory behind bridge: e0000000-e00fffff [size=1M] [32-bit]
	Prefetchable memory behind bridge: 00000000fff00000-00000000000fffff [disabled] [64-bit]
	Secondary status: 66MHz- FastB2B- ParErr- DEVSEL=fast >TAbort- <TAbort- <MAbort- <SERR- <PERR-
	BridgeCtl: Parity- SERR+ NoISA- VGA- VGA16- MAbort- >Reset- FastB2B-
		PriDiscTmr- SecDiscTmr- DiscTmrStat- DiscTmrSERREn-
	Capabilities: <access denied>
	Kernel driver in use: pcieport
	Kernel modules: shpchp

00:1f.0 ISA bridge: Intel Corporation 400 Series Chipset Family On-Package PCH-LP Prem-U LPC/eSPI Controller
	Subsystem: Hewlett-Packard Company Device 8723
	Control: I/O+ Mem+ BusMaster+ SpecCycle- MemWINV- VGASnoop- ParErr- Stepping- SERR- FastB2B- DisINTx+
	Status: Cap- 66MHz- UDF- FastB2B- ParErr- DEVSEL=fast >TAbort- <TAbort- <MAbort- >SERR- <PERR- INTx-
	Latency: 0
	IOMMU group: 10

00:1f.3 Multimedia audio controller: Intel Corporation 400 Series Chipset Family On-Package HD Audio
	Subsystem: Hewlett-Packard Company Device 8723
	Control: I/O- Mem+ BusMaster+ SpecCycle- MemWINV- VGASnoop- ParErr- Stepping- SERR- FastB2B- DisINTx+
	Status: Cap+ 66MHz- UDF- FastB2B- ParErr- DEVSEL=fast >TAbort- <TAbort- <MAbort- >SERR- <PERR- INTx-
	Latency: 64
	Interrupts: pin B disabled, MSI(X) routed to IRQ 182
	IOMMU group: 10
	Region 0: Memory at 404a108000 (64-bit, non-prefetchable) [size=16K]
	Region 4: Memory at 404a000000 (64-bit, non-prefetchable) [size=1M]
	Capabilities: <access denied>
	Kernel driver in use: sof-audio-pci-intel-cnl
	Kernel modules: snd_soc_avs, snd_sof_pci_intel_cnl, snd_hda_intel

00:1f.4 SMBus: Intel Corporation 400 Series Chipset Family On-Package SMBus
	Subsystem: Hewlett-Packard Company Device 8723
	Control: I/O+ Mem+ BusMaster- SpecCycle- MemWINV- VGASnoop- ParErr- Stepping- SERR- FastB2B- DisINTx-
	Status: Cap- 66MHz- UDF- FastB2B+ ParErr- DEVSEL=medium >TAbort- <TAbort- <MAbort- >SERR- <PERR- INTx-
	Interrupts: pin B routed to IRQ 16
	IOMMU group: 10
	Region 0: Memory at 404a10c000 (64-bit, non-prefetchable) [size=256]
	Region 4: I/O ports at efa0 [size=32]
	Kernel driver in use: i801_smbus
	Kernel modules: i2c_i801

00:1f.5 Serial bus controller: Intel Corporation 400 Series Chipset Family On-Package (details in full lspci)
	Subsystem: Hewlett-Packard Company Device 8723
	Control: I/O- Mem+ BusMaster- SpecCycle- MemWINV- VGASnoop- ParErr- Stepping- SERR- FastB2B- DisINTx+
	Status: Cap- 66MHz- UDF- FastB2B- ParErr- DEVSEL=fast >TAbort- <TAbort- <MAbort- >SERR- <PERR- INTx-
	IOMMU group: 10
	Region 0: Memory at 9c800000 (32-bit, non-prefetchable) [size=4K]
	Kernel driver in use: intel-spi
	Kernel modules: spi_intel_pci

01:00.0 PCI bridge: Intel Corporation JHL7540 Thunderbolt 3 Bridge [Titan Ridge 4C 2018] (rev 06) (prog-if 00 [Normal decode])
	Subsystem: Hewlett-Packard Company Device 8723
	Physical Slot: 4
	Control: I/O+ Mem+ BusMaster+ SpecCycle- MemWINV- VGASnoop- ParErr- Stepping- SERR- FastB2B- DisINTx-
	Status: Cap+ 66MHz- UDF- FastB2B- ParErr- DEVSEL=fast >TAbort- <TAbort- <MAbort- >SERR- <PERR- INTx-
	Latency: 0
	Interrupts: pin B routed to IRQ 16
	IOMMU group: 11
	Bus: primary=01, secondary=02, subordinate=6a, sec-latency=0
	I/O behind bridge: 4000-5fff [size=8K] [16-bit]
	Memory behind bridge: b0000000-ddffffff [size=736M] [32-bit]
	Prefetchable memory behind bridge: 4000000000-4049ffffff [size=1184M] [32-bit]
	Secondary status: 66MHz- FastB2B- ParErr- DEVSEL=fast >TAbort- <TAbort- <MAbort- <SERR- <PERR-
	BridgeCtl: Parity- SERR+ NoISA- VGA- VGA16- MAbort- >Reset- FastB2B-
		PriDiscTmr- SecDiscTmr- DiscTmrStat- DiscTmrSERREn-
	Capabilities: <access denied>
	Kernel driver in use: pcieport
	Kernel modules: shpchp

02:00.0 PCI bridge: Intel Corporation JHL7540 Thunderbolt 3 Bridge [Titan Ridge 4C 2018] (rev 06) (prog-if 00 [Normal decode])
	Subsystem: Hewlett-Packard Company Device 8723
	Control: I/O+ Mem+ BusMaster+ SpecCycle- MemWINV- VGASnoop- ParErr- Stepping- SERR- FastB2B- DisINTx-
	Status: Cap+ 66MHz- UDF- FastB2B- ParErr- DEVSEL=fast >TAbort- <TAbort- <MAbort- >SERR- <PERR- INTx-
	Latency: 0
	Interrupts: pin B routed to IRQ 16
	IOMMU group: 12
	Bus: primary=02, secondary=03, subordinate=03, sec-latency=0
	I/O behind bridge: 0000f000-00000fff [disabled] [32-bit]
	Memory behind bridge: ddf00000-ddffffff [size=1M] [32-bit]
	Prefetchable memory behind bridge: 00000000fff00000-00000000000fffff [disabled] [64-bit]
	Secondary status: 66MHz- FastB2B- ParErr- DEVSEL=fast >TAbort- <TAbort- <MAbort- <SERR- <PERR-
	BridgeCtl: Parity- SERR+ NoISA- VGA- VGA16- MAbort- >Reset- FastB2B-
		PriDiscTmr- SecDiscTmr- DiscTmrStat- DiscTmrSERREn-
	Capabilities: <access denied>
	Kernel driver in use: pcieport
	Kernel modules: shpchp

02:01.0 PCI bridge: Intel Corporation JHL7540 Thunderbolt 3 Bridge [Titan Ridge 4C 2018] (rev 06) (prog-if 00 [Normal decode])
	Subsystem: Hewlett-Packard Company Device 8723
	Control: I/O+ Mem+ BusMaster+ SpecCycle- MemWINV- VGASnoop- ParErr- Stepping- SERR- FastB2B- DisINTx+
	Status: Cap+ 66MHz- UDF- FastB2B- ParErr- DEVSEL=fast >TAbort- <TAbort- <MAbort- >SERR- <PERR- INTx-
	Latency: 0
	Interrupts: pin B disabled, MSI(X) routed to IRQ 125
	IOMMU group: 13
	Bus: primary=02, secondary=04, subordinate=36, sec-latency=0
	I/O behind bridge: 4000-4fff [size=4K] [16-bit]
	Memory behind bridge: c7000000-ddefffff [size=367M] [32-bit]
	Prefetchable memory behind bridge: 4025000000-4049ffffff [size=592M] [32-bit]
	Secondary status: 66MHz- FastB2B- ParErr- DEVSEL=fast >TAbort- <TAbort- <MAbort- <SERR- <PERR-
	BridgeCtl: Parity- SERR+ NoISA- VGA- VGA16- MAbort- >Reset- FastB2B-
		PriDiscTmr- SecDiscTmr- DiscTmrStat- DiscTmrSERREn-
	Capabilities: <access denied>
	Kernel driver in use: pcieport
	Kernel modules: shpchp

02:02.0 PCI bridge: Intel Corporation JHL7540 Thunderbolt 3 Bridge [Titan Ridge 4C 2018] (rev 06) (prog-if 00 [Normal decode])
	Subsystem: Hewlett-Packard Company Device 8723
	Control: I/O+ Mem+ BusMaster+ SpecCycle- MemWINV- VGASnoop- ParErr- Stepping- SERR- FastB2B- DisINTx-
	Status: Cap+ 66MHz- UDF- FastB2B- ParErr- DEVSEL=fast >TAbort- <TAbort- <MAbort- >SERR- <PERR- INTx-
	Latency: 0
	Interrupts: pin B routed to IRQ 18
	IOMMU group: 14
	Bus: primary=02, secondary=37, subordinate=37, sec-latency=0
	I/O behind bridge: 0000f000-00000fff [disabled] [32-bit]
	Memory behind bridge: c6f00000-c6ffffff [size=1M] [32-bit]
	Prefetchable memory behind bridge: 00000000fff00000-00000000000fffff [disabled] [64-bit]
	Secondary status: 66MHz- FastB2B- ParErr- DEVSEL=fast >TAbort- <TAbort- <MAbort- <SERR- <PERR-
	BridgeCtl: Parity- SERR+ NoISA- VGA- VGA16- MAbort- >Reset- FastB2B-
		PriDiscTmr- SecDiscTmr- DiscTmrStat- DiscTmrSERREn-
	Capabilities: <access denied>
	Kernel driver in use: pcieport
	Kernel modules: shpchp

02:04.0 PCI bridge: Intel Corporation JHL7540 Thunderbolt 3 Bridge [Titan Ridge 4C 2018] (rev 06) (prog-if 00 [Normal decode])
	Subsystem: Hewlett-Packard Company Device 8723
	Control: I/O+ Mem+ BusMaster+ SpecCycle- MemWINV- VGASnoop- ParErr- Stepping- SERR- FastB2B- DisINTx+
	Status: Cap+ 66MHz- UDF- FastB2B- ParErr- DEVSEL=fast >TAbort- <TAbort- <MAbort- >SERR- <PERR- INTx-
	Latency: 0
	Interrupts: pin B disabled, MSI(X) routed to IRQ 126
	IOMMU group: 15
	Bus: primary=02, secondary=38, subordinate=6a, sec-latency=0
	I/O behind bridge: 5000-5fff [size=4K] [16-bit]
	Memory behind bridge: b0000000-c6efffff [size=367M] [32-bit]
	Prefetchable memory behind bridge: 4000000000-4024ffffff [size=592M] [32-bit]
	Secondary status: 66MHz- FastB2B- ParErr- DEVSEL=fast >TAbort- <TAbort- <MAbort- <SERR- <PERR-
	BridgeCtl: Parity- SERR+ NoISA- VGA- VGA16- MAbort- >Reset- FastB2B-
		PriDiscTmr- SecDiscTmr- DiscTmrStat- DiscTmrSERREn-
	Capabilities: <access denied>
	Kernel driver in use: pcieport
	Kernel modules: shpchp

03:00.0 System peripheral: Intel Corporation JHL7540 Thunderbolt 3 NHI [Titan Ridge 4C 2018] (rev 06)
	Subsystem: Hewlett-Packard Company Device 8723
	Control: I/O- Mem+ BusMaster+ SpecCycle- MemWINV- VGASnoop- ParErr- Stepping- SERR- FastB2B- DisINTx+
	Status: Cap+ 66MHz- UDF- FastB2B- ParErr- DEVSEL=fast >TAbort- <TAbort- <MAbort- >SERR- <PERR- INTx-
	Latency: 0
	Interrupts: pin B disabled, MSI(X) routed to IRQ 154-169
	IOMMU group: 16
	Region 0: Memory at ddf00000 (32-bit, non-prefetchable) [size=256K]
	Region 1: Memory at ddf40000 (32-bit, non-prefetchable) [size=4K]
	Capabilities: <access denied>
	Kernel driver in use: thunderbolt
	Kernel modules: thunderbolt

37:00.0 USB controller: Intel Corporation JHL7540 Thunderbolt 3 USB Controller [Titan Ridge 4C 2018] (rev 06) (prog-if 30 [XHCI])
	Subsystem: Hewlett-Packard Company Device 8723
	Control: I/O- Mem+ BusMaster- SpecCycle- MemWINV- VGASnoop- ParErr- Stepping- SERR- FastB2B- DisINTx+
	Status: Cap+ 66MHz- UDF- FastB2B- ParErr- DEVSEL=fast >TAbort- <TAbort- <MAbort- >SERR- <PERR- INTx-
	Interrupts: pin B disabled, MSI(X) routed to IRQ 135-142
	IOMMU group: 17
	Region 0: Memory at c6f00000 (32-bit, non-prefetchable) [size=64K]
	Capabilities: <access denied>
	Kernel driver in use: xhci_hcd
	Kernel modules: xhci_pci

6b:00.0 Non-Volatile memory controller: Sandisk Corp SanDisk Ultra 3D / WD PC SN530, IX SN530, Blue SN550 NVMe SSD (DRAM-less) (rev 01) (prog-if 02 [NVM Express])
	Subsystem: Sandisk Corp WD Blue SN550 NVMe SSD
	Control: I/O+ Mem+ BusMaster+ SpecCycle- MemWINV- VGASnoop- ParErr- Stepping- SERR- FastB2B- DisINTx+
	Status: Cap+ 66MHz- UDF- FastB2B- ParErr- DEVSEL=fast >TAbort- <TAbort- <MAbort- >SERR- <PERR- INTx-
	Latency: 0
	Interrupts: pin B disabled, MSI(X) routed to IRQ 143-151
	IOMMU group: 18
	Region 0: Memory at e0000000 (64-bit, non-prefetchable) [size=16K]
	Region 4: Memory at e0004000 (64-bit, non-prefetchable) [size=256]
	Capabilities: <access denied>
	Kernel driver in use: nvme
	Kernel modules: nvme

